{
  "$schema": "https://json-schema.org/draft/2020-12/schema",
  "$id": "https://publisher.genii.foundation/schemas/work.schema.json",
  "title": "GENII Publisher work manifest",
  "description": "Authoritative metadata and source locations for one work.",
  "type": "object",
  "additionalProperties": false,
  "required": [
    "schemaVersion",
    "id",
    "title",
    "language",
    "publicationState",
    "manuscript"
  ],
  "properties": {
    "$schema": {
      "const": "https://publisher.genii.foundation/schemas/work.schema.json"
    },
    "schemaVersion": {
      "$ref": "#/$defs/schemaVersion"
    },
    "id": {
      "$ref": "#/$defs/stableId"
    },
    "title": {
      "type": "string",
      "minLength": 1,
      "maxLength": 512
    },
    "subtitle": {
      "type": "string",
      "maxLength": 512
    },
    "summary": {
      "type": "string",
      "maxLength": 4096
    },
    "language": {
      "type": "string",
      "pattern": "^[A-Za-z]{2,3}(?:-[A-Za-z0-9]{2,8})*$"
    },
    "publicationState": {
      "enum": [
        "draft",
        "published",
        "unlisted",
        "archived"
      ]
    },
    "publishedAt": {
      "type": "string",
      "format": "date-time"
    },
    "updatedAt": {
      "type": "string",
      "format": "date-time"
    },
    "route": {
      "$ref": "#/$defs/routePath"
    },
    "manuscript": {
      "$ref": "#/$defs/sourcePath"
    },
    "assets": {
      "$ref": "#/$defs/sourcePath"
    },
    "sections": {
      "type": "array",
      "minItems": 1,
      "maxItems": 50000,
      "items": {
        "$ref": "#/$defs/sectionDeclaration"
      },
      "description": "Explicit preorder section structure. IDs, routes, hierarchy, and continuity are durable author data. Source selectors locate boundaries but never derive those identities."
    },
    "metadata": {
      "type": "object",
      "additionalProperties": true
    }
  },
  "$defs": {
    "schemaVersion": {
      "type": "string",
      "const": "1.0"
    },
    "stableId": {
      "type": "string",
      "minLength": 1,
      "maxLength": 128,
      "pattern": "^(?!(?:con|prn|aux|nul|com[1-9]|lpt[1-9])(?:\\.|$))[a-z0-9]+(?:[._-][a-z0-9]+)*$"
    },
    "contentId": {
      "type": "string",
      "minLength": 1,
      "maxLength": 256,
      "pattern": "^(?!(?:con|prn|aux|nul|com[1-9]|lpt[1-9])(?:\\.|$))[a-z0-9]+(?:[._-][a-z0-9]+)*$"
    },
    "sectionStart": {
      "oneOf": [
        {
          "type": "object",
          "additionalProperties": false,
          "required": ["kind"],
          "properties": {
            "kind": { "const": "document" }
          }
        },
        {
          "type": "object",
          "additionalProperties": false,
          "required": ["kind", "blockKind", "text"],
          "properties": {
            "kind": { "const": "block" },
            "blockKind": { "$ref": "#/$defs/stableId" },
            "text": {
              "type": "string",
              "minLength": 1,
              "maxLength": 4096
            },
            "occurrence": {
              "type": "integer",
              "minimum": 1,
              "maximum": 100000
            }
          }
        }
      ]
    },
    "continuity": {
      "type": "object",
      "additionalProperties": false,
      "required": ["id", "legacyIds", "progressGroups", "historicalSectionIds"],
      "properties": {
        "id": { "$ref": "#/$defs/contentId" },
        "legacyIds": {
          "type": "array",
          "maxItems": 50000,
          "uniqueItems": true,
          "items": { "$ref": "#/$defs/contentId" }
        },
        "progressGroups": {
          "type": "array",
          "minItems": 1,
          "maxItems": 50000,
          "items": {
            "type": "array",
            "minItems": 1,
            "maxItems": 50000,
            "items": { "$ref": "#/$defs/contentId" }
          }
        },
        "historicalSectionIds": {
          "type": "array",
          "maxItems": 50000,
          "uniqueItems": true,
          "items": { "$ref": "#/$defs/contentId" }
        }
      }
    },
    "sectionDeclaration": {
      "type": "object",
      "additionalProperties": false,
      "required": ["id", "title", "start"],
      "properties": {
        "id": { "$ref": "#/$defs/contentId" },
        "title": {
          "type": "string",
          "minLength": 1,
          "maxLength": 512
        },
        "role": { "$ref": "#/$defs/stableId" },
        "parentId": { "$ref": "#/$defs/contentId" },
        "route": { "$ref": "#/$defs/routePath" },
        "navigable": { "type": "boolean" },
        "start": { "$ref": "#/$defs/sectionStart" },
        "continuity": { "$ref": "#/$defs/continuity" },
        "metadata": {
          "type": "object",
          "additionalProperties": true
        }
      }
    },
    "relativePath": {
      "type": "string",
      "minLength": 1,
      "maxLength": 1024,
      "pattern": "^(?!.*[\\uD800-\\uDFFF])(?!.*[\\u061C\\u200E\\u200F\\u2028-\\u202E\\u2066-\\u2069])(?![A-Za-z]:)(?!/)(?!.*\\\\)(?!.*[<>:\"|*])(?!.*%[0-9A-Fa-f]{2})(?!.*[?#])(?!.*[\\u0000-\\u001F\\u007F])(?!\\.{1,2}(?:/|$))(?!.*\\/\\.{1,2}(?:\\/|$))(?!.*(?:^|/)(?:[Cc][Oo][Nn]|[Pp][Rr][Nn]|[Aa][Uu][Xx]|[Nn][Uu][Ll]|[Cc][Oo][Mm][1-9¹²³]|[Ll][Pp][Tt][1-9¹²³])(?:\\.[^/]*)?(?:/|$))(?!.*[. ](?:/|$))(?!.*//)(?!.*\\/$).+$"
    },
    "repositoryRelativePath": {
      "type": "object",
      "additionalProperties": false,
      "required": [
        "path",
        "relativeTo"
      ],
      "properties": {
        "path": {
          "$ref": "#/$defs/relativePath"
        },
        "relativeTo": {
          "const": "repository"
        }
      }
    },
    "sourcePath": {
      "oneOf": [
        {
          "$ref": "#/$defs/relativePath"
        },
        {
          "$ref": "#/$defs/repositoryRelativePath"
        }
      ],
      "description": "A string is relative to the work manifest directory. Repository relative paths require an explicit tagged object."
    },
    "routePath": {
      "type": "string",
      "minLength": 1,
      "maxLength": 2048,
      "oneOf": [
        {
          "const": "/"
        },
        {
          "type": "string",
          "minLength": 2,
          "maxLength": 2048,
          "pattern": "^/(?!/)(?!\\.{1,2}(?:/|$))(?!.*\\/\\.{1,2}(?:\\/|$))(?!.*//)(?!.*(?:%C2%(?:8[0-9A-F]|9[0-9A-F]|A0)|%E1%9A%80|%E2%80%(?:8[0-9A]|A[89F])|%E2%81%9F|%E3%80%80|%EF%BB%BF))(?:[A-Za-z0-9._~!$&'()*+,;=:@/-]|%(?:C[2-9A-F]|D[0-9A-F])%[89AB][0-9A-F]|%E0%[AB][0-9A-F]%[89AB][0-9A-F]|%E(?:[1-C]|[E-F])%[89AB][0-9A-F]%[89AB][0-9A-F]|%ED%[89][0-9A-F]%[89AB][0-9A-F]|%F0%[9AB][0-9A-F]%[89AB][0-9A-F]%[89AB][0-9A-F]|%F[1-3]%[89AB][0-9A-F]%[89AB][0-9A-F]%[89AB][0-9A-F]|%F4%8[0-9A-F]%[89AB][0-9A-F]%[89AB][0-9A-F])+$",
          "description": "A canonical non-root route serialized as ASCII. Non-ASCII Unicode scalar values use uppercase UTF-8 percent encoding; ASCII octets are never percent encoded. Decoded NFC normalization is enforced by semantic validation."
        }
      ]
    }
  }
}
