{
  "$schema": "https://publisher.genii.foundation/schemas/work.schema.json",
  "schemaVersion": "1.0",
  "id": "signal-lantern",
  "title": "The Signal Lantern",
  "summary": "A station keeper tests a light after the last train.",
  "language": "en",
  "publicationState": "published",
  "publishedAt": "2025-11-03T21:15:00Z",
  "route": "/dispatch/signal-lantern",
  "manuscript": "text.md"
}
